{
  "$schema": "https://json-schema.org/draft/2020-12/schema",
  "$id": "https://meridian.local/schemas/ui-generation-session.schema.json",
  "title": "Meridian UI Generation Session",
  "type": "object",
  "additionalProperties": false,
  "required": ["meta", "project", "artifacts", "approvals", "transitionHistory", "blockers", "supersedesSessionId"],
  "properties": {
    "meta": { "$ref": "#/$defs/meta" },
    "project": { "$ref": "#/$defs/project" },
    "artifacts": {
      "type": "array",
      "minItems": 1,
      "items": { "$ref": "#/$defs/artifact" }
    },
    "approvals": {
      "type": "array",
      "items": { "$ref": "#/$defs/approval" }
    },
    "transitionHistory": {
      "type": "array",
      "minItems": 1,
      "items": { "$ref": "#/$defs/transitionRecord" }
    },
    "blockers": {
      "type": "array",
      "items": { "$ref": "#/$defs/blocker" }
    },
    "supersedesSessionId": { "type": ["string", "null"] }
  },
  "$defs": {
    "id": { "type": "string", "pattern": "^[a-z][a-z0-9_-]*$" },
    "nonEmpty": { "type": "string", "minLength": 1 },
    "dateTime": { "type": "string", "pattern": "^\\d{4}-\\d{2}-\\d{2}T\\d{2}:\\d{2}:\\d{2}Z$" },
    "digest": { "type": "string", "pattern": "^sha256-[a-f0-9]{64}$" },
    "artifactDigest": {
      "type": "object",
      "additionalProperties": false,
      "required": ["artifactId", "digest"],
      "properties": {
        "artifactId": { "$ref": "#/$defs/id" },
        "digest": { "$ref": "#/$defs/digest" }
      }
    },
    "meta": {
      "type": "object",
      "additionalProperties": false,
      "required": ["schemaVersion", "kind", "id", "status", "state", "revision", "createdAt", "updatedAt"],
      "properties": {
        "schemaVersion": { "const": "0.1.0" },
        "kind": { "const": "ui-generation-session" },
        "id": { "$ref": "#/$defs/id" },
        "status": { "enum": ["active", "completed", "cancelled", "failed", "superseded"] },
        "state": { "$ref": "#/$defs/id" },
        "revision": { "type": "integer", "minimum": 1 },
        "createdAt": { "$ref": "#/$defs/dateTime" },
        "updatedAt": { "$ref": "#/$defs/dateTime" }
      }
    },
    "project": {
      "type": "object",
      "additionalProperties": false,
      "required": ["id", "rootRef"],
      "properties": {
        "id": { "$ref": "#/$defs/id" },
        "rootRef": { "type": "string", "minLength": 1 }
      }
    },
    "artifact": {
      "type": "object",
      "additionalProperties": false,
      "required": ["id", "type", "path", "schemaVersion", "digest", "revision", "ownership", "status"],
      "properties": {
        "id": { "$ref": "#/$defs/id" },
        "type": { "$ref": "#/$defs/id" },
        "path": { "type": "string", "pattern": "^[a-zA-Z0-9][a-zA-Z0-9._/-]*$" },
        "schemaVersion": { "type": "string", "pattern": "^[0-9]+\\.[0-9]+\\.[0-9]+$" },
        "digest": { "$ref": "#/$defs/digest" },
        "revision": { "type": "integer", "minimum": 1 },
        "ownership": { "enum": ["canonical", "derived", "evidence"] },
        "status": { "enum": ["current", "superseded", "invalid"] }
      }
    },
    "approval": {
      "type": "object",
      "additionalProperties": false,
      "required": ["id", "transitionId", "actor", "decision", "recordedAt", "artifactDigests", "notes"],
      "properties": {
        "id": { "$ref": "#/$defs/id" },
        "transitionId": { "$ref": "#/$defs/id" },
        "actor": {
          "type": "object",
          "additionalProperties": false,
          "required": ["type", "id", "role"],
          "properties": {
            "type": { "const": "human" },
            "id": { "$ref": "#/$defs/nonEmpty" },
            "role": { "$ref": "#/$defs/nonEmpty" }
          }
        },
        "decision": { "enum": ["approved", "rejected"] },
        "recordedAt": { "$ref": "#/$defs/dateTime" },
        "artifactDigests": {
          "type": "array",
          "minItems": 1,
          "items": { "$ref": "#/$defs/artifactDigest" }
        },
        "notes": { "type": "string" }
      }
    },
    "transitionRecord": {
      "type": "object",
      "additionalProperties": false,
      "required": ["id", "from", "to", "actorType", "actorId", "occurredAt", "approvalRef", "inputArtifactDigests"],
      "properties": {
        "id": { "$ref": "#/$defs/id" },
        "from": { "type": ["string", "null"] },
        "to": { "$ref": "#/$defs/id" },
        "actorType": { "enum": ["human", "ai", "system"] },
        "actorId": { "$ref": "#/$defs/nonEmpty" },
        "occurredAt": { "$ref": "#/$defs/dateTime" },
        "approvalRef": { "type": ["string", "null"] },
        "inputArtifactDigests": {
          "type": "array",
          "items": { "$ref": "#/$defs/artifactDigest" }
        }
      }
    },
    "blocker": {
      "type": "object",
      "additionalProperties": false,
      "required": ["id", "kind", "message", "artifactRefs", "blocksTransitions", "status"],
      "properties": {
        "id": { "$ref": "#/$defs/id" },
        "kind": { "enum": ["missing-input", "clarification", "validation", "research", "approval", "quality", "security"] },
        "message": { "$ref": "#/$defs/nonEmpty" },
        "artifactRefs": {
          "type": "array",
          "uniqueItems": true,
          "items": { "$ref": "#/$defs/id" }
        },
        "blocksTransitions": {
          "type": "array",
          "minItems": 1,
          "uniqueItems": true,
          "items": { "$ref": "#/$defs/id" }
        },
        "status": { "enum": ["open", "resolved"] }
      }
    }
  }
}
